{
  "$schema": "./schema/attack-paths.schema.json",
  "description": "Attack path definitions and remediation guidance. Paths describe how an existing control relationship can expose additional high-impact Entra ID access.",
  "version": "0.6.0",
  "lastUpdated": "2026-08-17",
  "paths": [
    {
      "id": "APP_OWNER_ESCALATION",
      "name": "App Owner Escalation",
      "severity": "Critical",
      "description": "A non-admin user owns an app registration that has dangerous application permissions. The user can add a new secret/certificate, authenticate as the app, and inherit its permissions.",
      "chain": [
        "User (no privileged role)",
        "Owns App Registration",
        "App has dangerous application permission",
        "User adds secret/certificate to app",
        "User authenticates as app using new credential",
        "User inherits app's dangerous permissions"
      ],
      "detection": {
        "method": "Cross-reference app owners (non-admins) with apps that have dangerous permissions",
        "graphQueries": [
          "GET /applications/{id}/owners",
          "GET /servicePrincipals/{id}/appRoleAssignments"
        ]
      },
      "remediation": [
        "Remove the non-admin user as owner of the app",
        "Replace the dangerous permission with a least-privilege alternative",
        "Apply Conditional Access for workload identities on the service principal",
        "Use Managed Identity instead of app registration where possible"
      ],
      "references": [
        "https://learn.microsoft.com/entra/identity/role-based-access-control/security-planning",
        "https://learn.microsoft.com/entra/identity/enterprise-apps/manage-application-permissions"
      ]
    },
    {
      "id": "SHADOW_ADMIN_SP",
      "name": "Shadow Admin via Service Principal Role",
      "severity": "Critical",
      "description": "A non-admin user owns a service principal that holds a privileged directory role. The user can reset the SP's credentials and act as the SP, inheriting its role.",
      "chain": [
        "User (no privileged role)",
        "Owns Service Principal",
        "Service Principal has privileged directory role",
        "User resets SP credentials",
        "User authenticates as SP",
        "User inherits SP's privileged role"
      ],
      "detection": {
        "method": "Cross-reference SP owners (non-admins) with SPs that hold privileged directory roles",
        "graphQueries": [
          "GET /servicePrincipals/{id}/owners",
          "GET /roleManagement/directory/roleAssignments?$filter=principalId eq '{spId}'"
        ]
      },
      "remediation": [
        "Remove the non-admin user as owner of the service principal",
        "Remove the privileged directory role from the service principal",
        "Use PIM for just-in-time role activation instead of permanent assignments"
      ],
      "references": [
        "https://learn.microsoft.com/entra/identity/role-based-access-control/privileged-roles-permissions"
      ]
    },
    {
      "id": "CONSENT_GRANT_ATTACK",
      "name": "Consent Grant Attack",
      "severity": "High",
      "description": "If tenant policy allows user consent, a phishing attack can trick users into granting OAuth consent to a malicious app, giving the attacker access to user data.",
      "chain": [
        "Tenant allows user consent for apps",
        "User is targeted by phishing",
        "User grants OAuth consent to malicious app",
        "Malicious app accesses user's mail, files, or profile"
      ],
      "detection": {
        "method": "Check tenant authorization policy for user consent settings; enumerate user-consented OAuth2 permission grants",
        "graphQueries": [
          "GET /policies/authorizationPolicy",
          "GET /oauth2PermissionGrants?$filter=consentType eq 'Principal'"
        ]
      },
      "remediation": [
        "Set user consent to 'Do not allow user consent' or 'Allow for verified publishers only'",
        "Enable admin consent workflow so users can request access",
        "Review and revoke suspicious user-consented permissions",
        "Configure risk-based consent evaluation policies"
      ],
      "references": [
        "https://learn.microsoft.com/entra/identity/enterprise-apps/configure-user-consent",
        "https://learn.microsoft.com/entra/identity/enterprise-apps/manage-application-permissions"
      ]
    },
    {
      "id": "STALE_APP_EXPLOITATION",
      "name": "Stale App Credential Exploitation",
      "severity": "High",
      "description": "A high-privilege app has not signed in for an extended period but still has valid credentials. An attacker who obtains the credentials can authenticate as the app and exploit its permissions.",
      "chain": [
        "App has dangerous permissions",
        "App has not signed in for 90+ days",
        "App still has valid (non-expired) credentials",
        "Attacker discovers credentials (repo leak, config file, etc.)",
        "Attacker authenticates as app",
        "Attacker inherits dangerous permissions"
      ],
      "detection": {
        "method": "Cross-reference high-privilege apps with sign-in activity and credential expiry dates",
        "graphQueries": [
          "GET /servicePrincipals/{id}/appRoleAssignments",
          "GET /beta/reports/servicePrincipalSignInActivities",
          "GET /applications/{id}?$select=passwordCredentials,keyCredentials"
        ]
      },
      "remediation": [
        "Disable or delete the app if no longer needed",
        "Remove the dangerous permissions if the app is still needed",
        "Rotate and then revoke the credentials",
        "Set up alerts for sign-in activity on high-privilege apps"
      ],
      "references": [
        "https://learn.microsoft.com/entra/identity/enterprise-apps/manage-application-permissions"
      ]
    },
    {
      "id": "CREDENTIAL_THEFT_SECRET",
      "name": "Credential Theft via Client Secret",
      "severity": "High",
      "description": "A high-privilege app uses a client secret (plain text string) rather than a certificate or managed identity. Secrets are easier to exfiltrate from code repos, config files, or environment variables.",
      "chain": [
        "App has dangerous permissions",
        "App uses client secret (not certificate or managed identity)",
        "Secret stored in code repo, config file, Key Vault, or environment variable",
        "Attacker gains access to secret storage",
        "Attacker authenticates as app using secret",
        "Attacker inherits dangerous permissions"
      ],
      "detection": {
        "method": "Check credential types on high-privilege apps; flag password credentials over certificates or federated credentials",
        "graphQueries": [
          "GET /applications/{id}?$select=passwordCredentials,keyCredentials,federatedIdentityCredentials"
        ]
      },
      "remediation": [
        "Migrate from client secret to certificate authentication",
        "Use Managed Identity where the app runs in Azure",
        "Use Federated Identity Credentials for external workloads (GitHub Actions, etc.)",
        "If secrets are required, store them in Azure Key Vault with access policies"
      ],
      "references": [
        "https://learn.microsoft.com/entra/identity/enterprise-apps/certificate-management"
      ]
    },
    {
      "id": "ROLE_BASED_SP_CONTROL",
      "name": "Application-Control Role Reaches Privileged Service Principals",
      "severity": "Critical",
      "description": "A user whose current built-in or custom role permissions allow application or service-principal credential changes may be able to authenticate as a service principal that holds a more sensitive directory role.",
      "chain": [
        "User holds a built-in or custom role with service-principal credential control",
        "Tenant has service principals with privileged directory roles",
        "User adds a new secret/certificate to the privileged SP",
        "User authenticates as the SP using the new credential",
        "User inherits the SP's privileged directory role"
      ],
      "detection": {
        "method": "Cross-reference current role-definition capabilities and assignment scope against SPs holding sensitive directory roles, then account for existing user roles and app instance lock",
        "graphQueries": [
          "GET /roleManagement/directory/roleAssignments?$expand=principal",
          "GET /roleManagement/directory/roleDefinitions"
        ]
      },
      "remediation": [
        "Use PIM with approval workflow for application-control roles",
        "Scope custom and built-in application-control assignments as narrowly as possible",
        "Enable app instance lock where the service-principal credential route can be blocked",
        "Monitor SP credential changes in Entra audit logs",
        "Remove permanent Application Administrator assignments where possible"
      ],
      "references": [
        "https://posts.specterops.io/azure-privilege-escalation-via-service-principal-abuse-210ae2be2a5",
        "https://learn.microsoft.com/entra/identity/role-based-access-control/permissions-reference#application-administrator"
      ]
    },
    {
      "id": "UNOWNED_PRIVILEGED_APP",
      "name": "Unowned Application with Dangerous Permissions",
      "severity": "High",
      "description": "An application has high-impact permissions but no assigned owners. Without an owner, there is no accountability for credential rotation, access reviews, or lifecycle management. If credentials exist, they may be stale and at risk of exploitation.",
      "chain": [
        "Application has high-impact permissions",
        "No owners assigned to the application",
        "No accountability for credential rotation",
        "Credentials may be stale or compromised",
        "Attacker discovers and uses existing credentials",